{
  "schema_version": 1,
  "detection_id": "MSEC-DET-0040",
  "implementation": "content/portable/sigma/MSEC-DET-0040/rule.yml",
  "cases": [
    {
      "id": "sethc-debugger",
      "expectation": "match",
      "fixture": "fixtures/sethc-debugger.json",
      "description": "Synthetic IFEO Debugger value targets sethc.exe."
    },
    {
      "id": "utilman-debugger-uppercase",
      "expectation": "match",
      "fixture": "fixtures/utilman-debugger-uppercase.json",
      "description": "Synthetic mixed-case IFEO Debugger value targets utilman.exe."
    },
    {
      "id": "narrator-debugger-with-context",
      "expectation": "match",
      "fixture": "fixtures/narrator-debugger-with-context.json",
      "description": "Synthetic IFEO Debugger value targets Narrator with bounded registry context."
    },
    {
      "id": "other-ifeo-executable",
      "expectation": "no_match",
      "fixture": "fixtures/other-ifeo-executable.json",
      "description": "Synthetic Debugger value targets an unselected executable."
    },
    {
      "id": "other-value-name",
      "expectation": "no_match",
      "fixture": "fixtures/other-value-name.json",
      "description": "Synthetic selected IFEO key sets a different value name."
    },
    {
      "id": "non-ifeo-path",
      "expectation": "no_match",
      "fixture": "fixtures/non-ifeo-path.json",
      "description": "Synthetic Debugger value appears outside Image File Execution Options."
    },
    {
      "id": "missing-value-name",
      "expectation": "no_match",
      "fixture": "fixtures/missing-value-name.json",
      "description": "Synthetic selected IFEO key lacks the Debugger value name."
    },
    {
      "id": "debugger-value-deleted",
      "expectation": "no_match",
      "fixture": "fixtures/debugger-value-deleted.json",
      "description": "Synthetic regression: removing the debugger is not installing persistence."
    },
    {
      "id": "debugger-value-empty",
      "expectation": "no_match",
      "fixture": "fixtures/debugger-value-empty.json",
      "description": "Synthetic regression: empty debugger data contains no payload."
    },
    {
      "id": "debugger-value-missing",
      "expectation": "no_match",
      "fixture": "fixtures/debugger-value-missing.json",
      "description": "Synthetic regression: missing data is not evidence of hijack."
    },
    {
      "id": "lookalike-user-ifeo-path",
      "expectation": "no_match",
      "fixture": "fixtures/lookalike-user-ifeo-path.json",
      "description": "Synthetic regression: the per-user lookalike path is not machine IFEO."
    }
  ]
}
